{
  "id": "Q-MODEL-494",
  "title": "Thermodynamic pairing order in the stripe regime of the square-lattice Hubbard model",
  "domain": "Condensed matter theory",
  "cross_domains": [
    "Statistical physics",
    "Quantum theory"
  ],
  "kind": "literature_open",
  "statement": "For the zero-temperature repulsive square-lattice Hubbard model with nearest-neighbor hopping t, on-site repulsion U, t'=0 and hole doping delta=1/6, determine whether superconducting pairing persists in the two-dimensional thermodynamic limit at U/t=10 and at U/t=15, the two stronger-coupling stripe cases studied by Roth et al. Treat the two parameter cases separately.",
  "source_ids": [
    "SRC-PHYS-003",
    "SRC-PHYS-004",
    "SRC-PHYS-005"
  ],
  "source_locator": "SRC-PHYS-003 section IV.3; SRC-PHYS-004 model parameters and discussion; SRC-PHYS-005 pp. 2-3.",
  "status": "source_reports_open",
  "status_basis": "Roth et al. explicitly leave persistence of stripe-phase pairing unresolved. Inspected 2026 claims use different doping or hopping parameters; no resolution of this exact target was found.",
  "last_checked": "2026-10-20",
  "curator_origin": false,
  "duplicate_key": "phys:hubbard-square:tprime0:doping1-6:stripe-pairing-thermodynamic",
  "proposed_card": true,
  "primary_domain_id": "PHYS.COND",
  "cross_domain_ids": [
    "PHYS.STAT",
    "PHYS.QUANT"
  ],
  "curation_level": "C",
  "human_review_status": "pending",
  "plain_summary": "Electron stripes and superconducting pairing compete or coexist in the Hubbard model. Pairing on a finite cluster may disappear as both dimensions grow; the source leaves this limit unresolved.",
  "assumptions": [
    "H=-t sum_<ij>,sigma (c†_i,sigma c_j,sigma+h.c.) +U sum_i n_i,up n_i,down on the square lattice; t>0, no next-nearest hopping, and delta=1-N_e/N_sites=1/6. Consider zero temperature and U/t=10 and 15 separately.",
    "Specify lattice shape, boundaries and particle-number convention before comparing results.",
    "The two-dimensional limit requires both linear dimensions to grow; a fixed-width cylinder has a different limit."
  ],
  "scope": "Pairing in the source's strong-coupling stripe regime, not a complete phase diagram or a claim about every cuprate.",
  "target": "Determine whether long-range superconducting order survives, with controlled treatment of finite-size and method errors.",
  "success_criteria": [
    "Specify a singlet-pair observable and long-range-order criterion, and assess its limit alongside stripe correlations. Explain how particle-number conservation and boundary pinning enter the estimator.",
    "Report competing states and uncertainty from geometry, ansatz, optimization and sampling.",
    "Identify numerical evidence as such; a rigorous theorem requires a separate proof."
  ],
  "known_results": [
    "SRC-PHYS-003 reports pairing in a 144-site stripe state and explicitly leaves the thermodynamic question open.",
    "SRC-PHYS-004 reports later superconductivity evidence at delta=1/8, U/t=8, t'/t=-0.2; these parameters differ.",
    "SRC-PHYS-005 makes broad resolution claims but uses U/t=6 and nonzero t'/t in the inspected setup."
  ],
  "prerequisites": [
    "Fermionic many-body Hamiltonians",
    "Pair correlations and symmetry breaking",
    "Variational Monte Carlo or tensor-network methods",
    "Finite-size scaling and error analysis"
  ],
  "significance": "Clarifying intertwined orders in a central interacting-electron model would improve theoretical understanding of correlated superconductivity.",
  "relations": [],
  "requirements": {
    "experiment": "None for the model calculation. Material-specific relevance needs independent empirical support.",
    "data": "Model inputs are specified analytically; reuse numerical data only with documented parameters and provenance. Raw-data availability remains unchecked.",
    "compute": "Substantial GPU/HPC resources may be necessary. Source Table 4 reports roughly 500 H200 GPU-hours for one 144-site training case and 10,000 for a 288-site case; these are author estimates, not project measurements or promised budgets.",
    "theoretical_assumptions": "Ground-state conclusions depend on control of variational and extrapolation errors; a trial-state energy is only an upper bound."
  },
  "ai_assessment": {
    "priority": "exploratory",
    "rationale": "AI may help compare methods, implement diagnostics and audit uncertainty; full ground-state inference remains demanding.",
    "dimensions": {
      "clarity": {
        "rating": "high",
        "reason": "Hamiltonian, doping and two parameter cases are fixed; each attempt must state which case and order criterion it addresses."
      },
      "decomposability": {
        "rating": "medium",
        "reason": "Geometry, estimator and optimization checks can be separated."
      },
      "methods": {
        "rating": "high",
        "reason": "Several established numerical approaches provide comparison points."
      },
      "search_or_symbolic": {
        "rating": "medium",
        "reason": "Code and algebra help, while unrestricted many-body optimization remains difficult."
      },
      "checkability": {
        "rating": "low",
        "reason": "Independent large-system checks may themselves be expensive."
      },
      "expertise": {
        "rating": "high",
        "reason": "Specialists must assess competing orders and systematic errors."
      },
      "significance": {
        "rating": "high",
        "reason": "The question addresses correlated superconductivity in a widely studied model."
      },
      "verification_difficulty": {
        "rating": "high",
        "reason": "Close energies and different finite-size limits complicate review."
      }
    },
    "evidence_level": "untested_forecast",
    "uncertainty": "No research model has been tested on this task by the project; capability and resource expectations remain provisional.",
    "assessment_date": "2026-10-20",
    "model_scope": "A model able to inspect primary literature and use scientific code, with specialist oversight; no specific model benchmarked.",
    "evidence_refs": []
  },
  "methods": [
    "Published neural-state and variational approaches",
    "Independent correlation estimators",
    "Comparison across geometries and numerical methods"
  ],
  "method_tags": [
    "model_analysis",
    "numerical_computation",
    "bounds"
  ],
  "validation_tags": [
    "numerical_evidence",
    "pure_proof"
  ],
  "experimental_dependency": "none_for_formal_task",
  "obstacles": [
    "Fermionic sign problem and variational bias",
    "Nearly competing states",
    "Finite clusters may not resolve pairing length scales",
    "Large independent calculations can be costly"
  ],
  "validation": {
    "steps": [
      "Match hopping signs, doping, interaction strength, boundary conditions and observable normalization.",
      "Benchmark small instances independently; retain convergence data, seeds and error estimates.",
      "Compare more than one geometry and initial state; report limitations of the chosen state family.",
      "Check the two-dimensional limit and distinguish pair formation from long-range order."
    ],
    "human_review_difficulty": "High: review requires many-body expertise and access to reproducible numerical evidence.",
    "statement_alignment": "Finite-size pairing or a lower variational energy alone does not prove superconductivity of the exact infinite-system ground state."
  },
  "known_attempts": [
    "Published simulations in SRC-PHYS-003 and related work provide context; no project attempt has been run."
  ],
  "unresolved_checks": [
    "Independent reproduction",
    "Raw-data and software availability",
    "Completeness of later literature and parameter matching"
  ],
  "attribution": {
    "original_authors": [
      "Christopher Roth",
      "Ao Chen",
      "Anirvan Sengupta",
      "Antoine Georges"
    ],
    "citation": "Roth, Chen, Sengupta and Georges, Superconductivity in the two-dimensional Hubbard model revealed by neural quantum states, arXiv:2511.07566v1 (2025), section IV.3; cite the related studies separately when used.",
    "curator_credit": "Compiled for Theory Research Atlas with Codex assistance."
  },
  "status_search": {
    "queries": [
      "\"Hubbard\" \"stripe\" \"thermodynamic\" \"2026\" superconductivity",
      "\"2511.07566\" superconductivity 2026",
      "Hubbard superconductivity one sixth doping stripes 2026 thermodynamic Roth",
      "\"Hubbard\" \"1/6\" \"thermodynamic\""
    ],
    "checked_sources": [
      "SRC-PHYS-003",
      "SRC-PHYS-004",
      "SRC-PHYS-005"
    ],
    "result": "Inspected later claims do not match the indexed parameters.",
    "limitations": "Targeted search; no independent evaluation of published numerical conclusions."
  },
  "epistemic_layers": {
    "formal_validity": "A theorem needs exact assumptions; simulations provide evidence with stated systematic and statistical errors.",
    "empirical_support": "A Hubbard-model result alone does not establish the mechanism of a particular material."
  },
  "judgments": {
    "difficulty": {
      "rating": "high",
      "basis": "Thermodynamic many-body inference and competing orders remain difficult.",
      "evidence": "Source's explicit limit question and reported numerical cost."
    },
    "correctness": {
      "status": "not_assessed",
      "basis": "No candidate solution supplied."
    },
    "novelty": {
      "status": "not_assessed",
      "basis": "Newness depends on exact parameters and future literature checks."
    },
    "significance": {
      "rating": "high",
      "basis": "Intertwined electronic orders are central to correlated superconductivity."
    }
  },
  "revision_history": [
    {
      "date": "2026-10-20",
      "change": "Recorded the thermodynamic target and distinguished later claims with different parameters."
    }
  ]
}
